{
  "$schema": "http://json-schema.org/draft-07/schema#",
  "$id": "https://clawmaven.com/schemas/v0.1.0/run-report.schema.json",
  "title": "Agent Run Report",
  "description": "Structured audit record for a single execution of an AI agent. Produced at the end of each run and retained for review, compliance, and debugging.",
  "type": "object",
  "required": ["schema_version", "run_id", "agent_name", "started_at", "outcome"],
  "properties": {
    "schema_version": {
      "type": "string",
      "description": "Version of this schema. Use '0.1.0' for files conforming to the ClawMaven Open Governance Kit v0.1.0."
    },
    "run_id": {
      "type": "string",
      "description": "Unique identifier for this run. Use UUID v4 or a system-generated identifier.",
      "examples": ["run_01HZ3K4M9P2QRTV8XYZ0"]
    },
    "agent_name": {
      "type": "string",
      "description": "Name of the agent that produced this run report.",
      "minLength": 1
    },
    "runtime": {
      "type": "string",
      "description": "The runtime or framework the agent ran on.",
      "examples": ["langchain", "autogpt", "crewai", "openai-assistants", "custom"]
    },
    "started_at": {
      "type": "string",
      "format": "date-time",
      "description": "ISO 8601 timestamp when the run started."
    },
    "completed_at": {
      "type": "string",
      "format": "date-time",
      "description": "ISO 8601 timestamp when the run completed (or was halted)."
    },
    "objective": {
      "type": "string",
      "description": "The task or goal this agent was asked to complete for this run.",
      "maxLength": 1024
    },
    "actions_taken": {
      "type": "array",
      "description": "Ordered list of actions the agent took during this run.",
      "items": {
        "type": "object",
        "required": ["action", "timestamp"],
        "properties": {
          "sequence": {
            "type": "integer",
            "description": "Order in which this action occurred.",
            "minimum": 1
          },
          "action": {
            "type": "string",
            "description": "Name or category of the action taken."
          },
          "tool": {
            "type": "string",
            "description": "Name of the tool called, if applicable."
          },
          "input_summary": {
            "type": "string",
            "description": "Brief description of the input passed. Do not include secrets or PII.",
            "maxLength": 512
          },
          "output_summary": {
            "type": "string",
            "description": "Brief description of the output received. Do not include secrets or PII.",
            "maxLength": 512
          },
          "timestamp": {
            "type": "string",
            "format": "date-time"
          },
          "duration_ms": {
            "type": "integer",
            "description": "How long this action took in milliseconds.",
            "minimum": 0
          }
        }
      }
    },
    "approvals_requested": {
      "type": "array",
      "description": "Human approval requests made during this run.",
      "items": {
        "type": "object",
        "required": ["reason", "requested_at", "status"],
        "properties": {
          "reason": {
            "type": "string",
            "description": "Why approval was requested."
          },
          "requested_at": {
            "type": "string",
            "format": "date-time"
          },
          "resolved_at": {
            "type": "string",
            "format": "date-time"
          },
          "status": {
            "type": "string",
            "enum": ["approved", "denied", "timed_out", "pending"]
          },
          "approver": {
            "type": "string",
            "description": "Name or identifier of the person who approved or denied."
          }
        }
      }
    },
    "policy_violations": {
      "type": "array",
      "description": "Any policy rule violations that occurred or were attempted during this run.",
      "items": {
        "type": "object",
        "required": ["rule", "severity", "action_taken"],
        "properties": {
          "rule": {
            "type": "string",
            "description": "The policy rule that was violated or nearly violated."
          },
          "severity": {
            "type": "string",
            "enum": ["info", "warning", "violation", "critical"]
          },
          "description": {
            "type": "string",
            "description": "What happened and why it was flagged."
          },
          "action_taken": {
            "type": "string",
            "description": "How the system responded to the violation.",
            "examples": ["blocked", "logged_only", "escalated", "overridden_by_operator"]
          },
          "timestamp": {
            "type": "string",
            "format": "date-time"
          }
        }
      }
    },
    "spend_used": {
      "type": "object",
      "description": "Cost incurred during this run.",
      "properties": {
        "llm_cost_usd": {
          "type": "number",
          "description": "LLM inference cost in USD.",
          "minimum": 0
        },
        "tool_cost_usd": {
          "type": "number",
          "description": "External tool or API call cost in USD.",
          "minimum": 0
        },
        "total_cost_usd": {
          "type": "number",
          "description": "Total cost for this run in USD.",
          "minimum": 0
        },
        "tokens_used": {
          "type": "integer",
          "description": "Total LLM tokens consumed (prompt + completion).",
          "minimum": 0
        }
      }
    },
    "outcome": {
      "type": "string",
      "description": "The final outcome of this run.",
      "enum": ["success", "partial_success", "failed", "halted_by_policy", "halted_by_operator", "timed_out"]
    },
    "outcome_summary": {
      "type": "string",
      "description": "A brief human-readable summary of what happened and what was produced.",
      "maxLength": 1024
    },
    "reviewer_notes": {
      "type": "string",
      "description": "Optional notes added by a human reviewer after the run.",
      "maxLength": 2048
    },
    "reviewed_by": {
      "type": "string",
      "description": "Name or identifier of the human reviewer, if this run was reviewed."
    },
    "reviewed_at": {
      "type": "string",
      "format": "date-time",
      "description": "When the human review took place."
    }
  },
  "additionalProperties": false
}
