{
  "schema_version": "0.1.0",
  "run_id": "run_claudecode_20250115_047",
  "agent_name": "Claude Code Assistant",
  "runtime": "openai-assistants",
  "started_at": "2025-01-15T14:22:00Z",
  "completed_at": "2025-01-15T14:25:18Z",
  "objective": "Review the authentication module for security issues and generate a refactored version with improved input validation.",
  "actions_taken": [
    {
      "sequence": 1,
      "action": "list_directory",
      "tool": "list_directory",
      "input_summary": "Listed contents of src/auth/",
      "output_summary": "Found 6 files: index.ts, middleware.ts, token.ts, session.ts, validators.ts, types.ts",
      "timestamp": "2025-01-15T14:22:05Z",
      "duration_ms": 120
    },
    {
      "sequence": 2,
      "action": "read_file",
      "tool": "read_file",
      "input_summary": "Read src/auth/middleware.ts",
      "output_summary": "Retrieved 218 lines. Identified 3 potential issues: missing rate limiting, unvalidated redirect URLs, verbose error messages.",
      "timestamp": "2025-01-15T14:22:08Z",
      "duration_ms": 95
    },
    {
      "sequence": 3,
      "action": "read_file",
      "tool": "read_file",
      "input_summary": "Read src/auth/token.ts",
      "output_summary": "Retrieved 142 lines. Token expiry validation present. JWT secret sourced from env var (correct).",
      "timestamp": "2025-01-15T14:22:10Z",
      "duration_ms": 88
    },
    {
      "sequence": 4,
      "action": "run_linter",
      "tool": "run_linter",
      "input_summary": "Ran ESLint on src/auth/",
      "output_summary": "12 warnings, 2 errors (unused variable, missing null check). No security-specific lint rules triggered.",
      "timestamp": "2025-01-15T14:22:25Z",
      "duration_ms": 2800
    },
    {
      "sequence": 5,
      "action": "call_llm",
      "tool": "call_llm",
      "input_summary": "Analyze auth middleware and token files. Identify security concerns. Produce refactored middleware with rate limiting and input validation.",
      "output_summary": "Produced security review (4 findings, 2 medium, 2 low) and refactored middleware.ts with inline comments.",
      "timestamp": "2025-01-15T14:24:10Z",
      "duration_ms": 52000
    },
    {
      "sequence": 6,
      "action": "write_output_file",
      "tool": "write_output_file",
      "input_summary": "Write security-review.md and middleware.refactored.ts to output/auth-review/",
      "output_summary": "Two files written successfully.",
      "timestamp": "2025-01-15T14:25:15Z",
      "duration_ms": 62
    }
  ],
  "approvals_requested": [],
  "policy_violations": [],
  "spend_used": {
    "llm_cost_usd": 0.42,
    "tool_cost_usd": 0.00,
    "total_cost_usd": 0.42,
    "tokens_used": 28700
  },
  "outcome": "success",
  "outcome_summary": "Security review complete. 4 findings documented (2 medium, 2 low severity). Refactored middleware with rate limiting and input validation written to output/auth-review/. Ready for developer review and manual application.",
  "reviewer_notes": "Reviewed findings — rate limiting suggestion accepted, redirect URL validation to be implemented in follow-up ticket.",
  "reviewed_by": "J. Patel",
  "reviewed_at": "2025-01-15T15:10:00Z"
}
